{
  "url": "https://xrpl-py.readthedocs.io/en/stable/source/xrpl.asyncio.account.html",
  "section": "asyncio",
  "name": "Account Methods",
  "description": "",
  "classes": [],
  "methods": [
    {
      "id": "xrpl.asyncio.account.does_account_exist",
      "name": "does_account_exist",
      "signature": "async xrpl.asyncio.account.does_account_exist(address: str, client: Client, ledger_index: str | int = 'validated') → bool",
      "description": "Query the ledger for whether the account exists.\naddress – the account to query.\nclient – the network client used to make network calls.\nledger_index – The ledger index to use for the request. Must be an integer ledger value or “current” (the current working version), “closed” (for the closed-and-proposed version), or “validated” (the most recent version validated by consensus). The default is “validated”.\nWhether the account exists on the ledger.\nXRPLRequestFailureException – if the transaction fails.",
      "parameters": [
        "address – the account to query.",
        "client – the network client used to make network calls.",
        "ledger_index – The ledger index to use for the request. Must be an integer ledger value or “current” (the current working version), “closed” (for the closed-and-proposed version), or “validated” (the most recent version validated by consensus). The default is “validated”."
      ],
      "returns": [
        "Whether the account exists on the ledger."
      ],
      "examples": []
    },
    {
      "id": "xrpl.asyncio.account.get_account_root",
      "name": "get_account_root",
      "signature": "async xrpl.asyncio.account.get_account_root(address: str, client: Client, ledger_index: str | int = 'validated') → Dict[str, int | str]",
      "description": "Query the ledger for the AccountRoot object associated with a given address.\naddress – the account to query.\nclient – the network client used to make network calls.\nledger_index – The ledger index to use for the request. Must be an integer ledger value or “current” (the current working version), “closed” (for the closed-and-proposed version), or “validated” (the most recent version validated by consensus). The default is “validated”.\nThe AccountRoot dictionary for the address.\nXRPLRequestFailureException – if the rippled API call fails.",
      "parameters": [
        "address – the account to query.",
        "client – the network client used to make network calls.",
        "ledger_index – The ledger index to use for the request. Must be an integer ledger value or “current” (the current working version), “closed” (for the closed-and-proposed version), or “validated” (the most recent version validated by consensus). The default is “validated”."
      ],
      "returns": [
        "The AccountRoot dictionary for the address."
      ],
      "examples": []
    },
    {
      "id": "xrpl.asyncio.account.get_balance",
      "name": "get_balance",
      "signature": "async xrpl.asyncio.account.get_balance(address: str, client: Client, ledger_index: str | int = 'validated') → int",
      "description": "Query the ledger for the balance of the given account.\naddress – the account to query.\nclient – the network client used to make network calls.\nledger_index – The ledger index to use for the request. Must be an integer ledger value or “current” (the current working version), “closed” (for the closed-and-proposed version), or “validated” (the most recent version validated by consensus). The default is “validated”.\nThe balance of the address.",
      "parameters": [
        "address – the account to query.",
        "client – the network client used to make network calls.",
        "ledger_index – The ledger index to use for the request. Must be an integer ledger value or “current” (the current working version), “closed” (for the closed-and-proposed version), or “validated” (the most recent version validated by consensus). The default is “validated”."
      ],
      "returns": [
        "The balance of the address."
      ],
      "examples": []
    },
    {
      "id": "xrpl.asyncio.account.get_latest_transaction",
      "name": "get_latest_transaction",
      "signature": "async xrpl.asyncio.account.get_latest_transaction(account: str, client: Client) → Response",
      "description": "Fetches the most recent transaction on the ledger associated with an account.\naccount – the account to query.\nclient – the network client used to communicate with a rippled node.\nThe Response object containing the transaction info.\nXRPLRequestFailureException – if the transaction fails.",
      "parameters": [
        "account – the account to query.",
        "client – the network client used to communicate with a rippled node."
      ],
      "returns": [
        "The Response object containing the transaction info."
      ],
      "examples": []
    },
    {
      "id": "xrpl.asyncio.account.get_next_valid_seq_number",
      "name": "get_next_valid_seq_number",
      "signature": "async xrpl.asyncio.account.get_next_valid_seq_number(address: str, client: Client, ledger_index: str | int = 'current') → int",
      "description": "Query the ledger for the next available sequence number for an account.\naddress – the account to query.\nclient – the network client used to make network calls.\nledger_index – The ledger index to use for the request. Must be an integer ledger value or “current” (the current working version), “closed” (for the closed-and-proposed version), or “validated” (the most recent version validated by consensus). The default is “current”.\nThe next valid sequence number for the address.",
      "parameters": [
        "address – the account to query.",
        "client – the network client used to make network calls.",
        "ledger_index – The ledger index to use for the request. Must be an integer ledger value or “current” (the current working version), “closed” (for the closed-and-proposed version), or “validated” (the most recent version validated by consensus). The default is “current”."
      ],
      "returns": [
        "The next valid sequence number for the address."
      ],
      "examples": []
    }
  ],
  "submodules": []
}